Tweet,Sentimen,Tweet Length,Tokenized
 sebaliknya masa jabatan eksekutif yang tahun per periode perlu ditambah selama ini tahun pertama habis utk konsolidasi kabinet dan bulan terakhir habis utk tahun politik praktis masa kerja pemerintah hanya tersisa tahun periode,negatif,38,"['jabatan', 'eksekutif', 'periode', 'ditambah', 'habis', 'konsolidasi', 'kabinet', 'habis', 'politik', 'praktis', 'kerja', 'pemerintah', 'tersisa', 'periode']"
 sependapat mari kita lihat hari pertama kabinet prabowo mulyono fufufafa cari kerjanya tinggal hari lagi buat evaluasi dan nilai dibawah kah,negatif,25,"['sependapat', 'mari', 'lihat', 'kabinet', 'prabowo', 'mulyono', 'cari', 'kerjanya', 'tinggal', 'evaluasi', 'nilai', 'dibawah', 'kah']"
 ini menteri baiknya di pecat aja pak akan jadi parasit di kabinet ,negatif,15,"['menteri', 'baiknya', 'pecat', 'parasit', 'kabinet']"
 saat pidato ke negaraan di pelantikan saya percaya dgn beliau dalam mengelola negara tapi setelah melihat menteri kabinet nya langsung pupus harap saya terhadap beliau dari ,negatif,31,"['pidato', 'negaraan', 'pelantikan', 'percaya', 'beliau', 'mengelola', 'negara', 'menteri', 'kabinet', 'nya', 'langsung', 'pupus', 'harap', 'beliau']"
 om ndons bilangin ke pak gemoy libas aja tuch orang si mulyono di kabinet parasit mrk tuch berani gak pak gemoy,negatif,32,"['om', 'ndons', 'bilangin', 'gemoy', 'libas', 'tuch', 'orang', 'mulyono', 'kabinet', 'parasit', 'mrk', 'tuch', 'berani', 'gak', 'gemoy']"
prabowo ingatkan jajaran kabinet merah putih dukung penuh program makan bergizi ,netral,12,"['prabowo', 'ingatkan', 'jajaran', 'kabinet', 'merah', 'putih', 'dukung', 'penuh', 'program', 'makan', 'bergizi']"
 apa namanya kabinet zakat sudah tentu bagi kueh kalau soal nilai lihatlah kenerja sebelum nya di era presiden jokowi dodo kereta cepat jakarta bandung membengkak bos ku sampai menggunakan apbn belum lagi ikn dong janji sudah bukak ofis di nusantara kenyataan nya,negatif,46,"['namanya', 'kabinet', 'zakat', 'kueh', 'nilai', 'lihatlah', 'kenerja', 'nya', 'era', 'presiden', 'jokowi', 'dodo', 'kereta', 'cepat', 'jakarta', 'bandung', 'membengkak', 'bos', 'ku', 'apbn', 'ikn', 'janji', 'bukak', 'ofis', 'nusantara', 'kenyataan', 'nya']"
 kabinet gemuk ya gini melibatkan orang banyak makin banyak yg bikin blunder udah paling bener keep ur circle small,negatif,20,"['kabinet', 'gemuk', 'melibatkan', 'orang', 'bikin', 'blunder', 'udah', 'bener', 'keep', 'ur', 'circle', 'small']"
berdasarkan pp nomor tahun gaji pokok yang akan diterima mayor teddy sebagai sekretariat kabinet berkisar antara rp hingga ,netral,26,"['berdasarkan', 'pp', 'nomor', 'gaji', 'pokok', 'diterima', 'mayor', 'teddy', 'sekretariat', 'kabinet', 'berkisar', 'rp']"
 ajak makan malam keluarga besar presiden dan kabinet itu masuk kategori apa om ,negatif,14,"['ajak', 'makan', 'malam', 'keluarga', 'presiden', 'kabinet', 'masuk', 'kategori', 'om']"
 tidak ada yg salah dg seskab teddy indra wijaya dalam mengingatkan para anggota kabinet supaya menggunakan jabatan sesuai ketentuan,positif,20,"['salah', 'seskab', 'teddy', 'indra', 'wijaya', 'anggota', 'kabinet', 'jabatan', 'sesuai', 'ketentuan']"
ya gini kalo pemilihan kabinet berbasis popularitas,negatif,7,"['kalo', 'pemilihan', 'kabinet', 'berbasis', 'popularitas']"
kabinet merah putih kepolisian negara ri tidak lagi dibawah presiden tapi di bawah menkopulhukam seperti halnya tni benar gak nih ,negatif,21,"['kabinet', 'merah', 'putih', 'kepolisian', 'negara', 'dibawah', 'presiden', 'menkopulhukam', 'halnya', 'tni', 'gak']"
ada satu hal yang menjadi perhatian saya pada video ini dan ini bukan tentang ir tapi logowordmark kabinet merah putih benar benar ngelanjutin stylenya indonesia maju ,netral,27,"['perhatian', 'video', 'ir', 'logowordmark', 'kabinet', 'merah', 'putih', 'ngelanjutin', 'stylenya', 'indonesia', 'maju']"
 gas terus kabinet merah putih ,positif,9,"['gas', 'kabinet', 'merah', 'putih']"
 dashboard kpikinerja anggota kabinet bs dipantau oleh publik jd tdk ada lgi penilain yg subjektif atau like or dislike tp smua punya parameter yg jlas sesuai dgn progress kpi tsb,netral,31,"['dashboard', 'kpikinerja', 'anggota', 'kabinet', 'dipantau', 'publik', 'lgi', 'penilain', 'subjektif', 'like', 'or', 'dislike', 'smua', 'parameter', 'jlas', 'sesuai', 'progress', 'kpi', 'tsb']"
prabowo di rapat kabinet merah putih tidak ada yang kebal di sini kalau tidak mau kerja pecat saja prabowo ingatkan para menteri bekerja dgn giat demi rakyat kurangi rapat dan ceremonial kurangi study banding ke ln prabowo lakukan efisiensi ,negatif,41,"['prabowo', 'rapat', 'kabinet', 'merah', 'putih', 'kebal', 'kerja', 'pecat', 'prabowo', 'ingatkan', 'menteri', 'giat', 'rakyat', 'kurangi', 'rapat', 'ceremonial', 'kurangi', 'study', 'banding', 'ln', 'prabowo', 'lakukan', 'efisiensi']"
pihak istana menyebut kegiatan pembekalan yang diikuti jajaran kabinet merah putih di akmil magelang merupakan bentuk kebersamaan bukan ospek atau militerisme ,netral,22,"['istana', 'menyebut', 'kegiatan', 'pembekalan', 'diikuti', 'jajaran', 'kabinet', 'merah', 'putih', 'akmil', 'magelang', 'bentuk', 'kebersamaan', 'ospek', 'militerisme']"
presiden prabowo ungkap alasan bawa menteri kabinet merah putih ke lembah tidar magelang ,netral,14,"['presiden', 'prabowo', 'alasan', 'bawa', 'menteri', 'kabinet', 'merah', 'putih', 'lembah', 'tidar', 'magelang']"
 ini yg namanya kabinet gagahgagahan demi balas jasa akhirnya anggaran negara remuk amp endingnya rakyat di palak dlm bentuk pajak,negatif,21,"['namanya', 'kabinet', 'gagahgagahan', 'balas', 'jasa', 'anggaran', 'negara', 'remuk', 'amp', 'endingnya', 'rakyat', 'palak', 'bentuk', 'pajak']"
 kau bisa bedakan setmilpres sama sekretaris kabinet ,negatif,11,"['kau', 'bedakan', 'setmilpres', 'sekretaris', 'kabinet']"
mulai saling mengunci kasus korupsi jaman mulyono nipunegoro mangkuputro,negatif,9,"['mengunci', 'korupsi', 'jaman', 'mulyono', 'nipunegoro', 'mangkuputro']"
 goblok goblok anjing kabinet pd tolol semua,negatif,8,"['goblok', 'goblok', 'anjing', 'kabinet', 'pd', 'tolol']"
 kabinet gemoy apbn letoy,negatif,5,"['kabinet', 'gemoy', 'apbn', 'letoy']"
 nunggu arahan tugas tapi wara wiri kemana mana presiden sibuk ngurus kabinet sementara wapres sibuk pencitraan,negatif,17,"['nunggu', 'arahan', 'tugas', 'wara', 'wiri', 'kemana', 'presiden', 'sibuk', 'ngurus', 'kabinet', 'wapres', 'sibuk', 'pencitraan']"
 kabinet itu gemoy kalau semua rakyat jadi pejabat ,negatif,9,"['kabinet', 'gemoy', 'rakyat', 'pejabat']"
pengawalan amp kritik kabinet merah putih thn kedepan,negatif,9,"['pengawalan', 'amp', 'kritik', 'kabinet', 'merah', 'putih', 'thn', 'kedepan']"
segini gaji mayor teddy usai dilantik prabowo jadi sekretaris kabinet ,netral,11,"['segini', 'gaji', 'mayor', 'teddy', 'dilantik', 'prabowo', 'sekretaris', 'kabinet']"
 baru mudeng mayor teddydi angkat jd sekretaris kabinet gt y semoga bs mnguasai bid pkerjaan barunya dgn baik at least masiii tetap di bwh pengarahan om prabs sekpri kapolri di tarik jd pengawal presiden artinya itu calon jen di masa yad pecah bintang ntiii,negatif,47,"['mudeng', 'mayor', 'teddydi', 'angkat', 'sekretaris', 'kabinet', 'gt', 'y', 'semoga', 'mnguasai', 'bid', 'pkerjaan', 'barunya', 'at', 'least', 'masiii', 'bwh', 'pengarahan', 'om', 'prabs', 'sekpri', 'kapolri', 'tarik', 'pengawal', 'presiden', 'calon', 'jen', 'yad', 'pecah', 'bintang', 'ntiii']"
kabinet merah putih mengemban misi menuju indonesia emas,positif,8,"['kabinet', 'merah', 'putih', 'mengemban', 'misi', 'indonesia', 'emas']"
 kalau hal tsb bukannya sdh ada sekretariat negara dan kabinet ,netral,12,"['tsb', 'sekretariat', 'negara', 'kabinet']"
awokwokwokwok t pecat menteri prabowo kabinet merah putih pigai ,negatif,13,"['awokwokwokwok', 't', 'pecat', 'menteri', 'prabowo', 'kabinet', 'merah', 'putih', 'pigai']"
pengantar presiden subianto pada sidang kabinet paripurna di kantor presiden komplek istana kepresidenan jakarta oktober ,netral,21,"['pengantar', 'presiden', 'subianto', 'sidang', 'kabinet', 'paripurna', 'kantor', 'presiden', 'komplek', 'istana', 'kepresidenan', 'jakarta', 'oktober']"
 heeem kabinet penggerusan uang rakyat ,negatif,6,"['heeem', 'kabinet', 'penggerusan', 'uang', 'rakyat']"
bisa saja hari masa kerja kabinet prabowo habis oleh kegiatan seremonial lontaklantik pejabat baru hingga kekhawatiran lambannya kabinet jumbo bisa saja terbukti,negatif,23,"['kerja', 'kabinet', 'prabowo', 'habis', 'kegiatan', 'seremonial', 'lontaklantik', 'pejabat', 'kekhawatiran', 'lambannya', 'kabinet', 'jumbo', 'terbukti']"
kuharap menterimenteri kabinet merah putih ini kedepannya jangan asbun ya sekalinya salah ngomong yakin bakal digoreng sampai akhir kabinet wkwk,negatif,20,"['kuharap', 'menterimenteri', 'kabinet', 'merah', 'putih', 'kedepannya', 'asbun', 'sekalinya', 'salah', 'ngomong', 'digoreng', 'kabinet', 'wkwk']"
untuk pertama kalinya presiden didampingi wakil presiden gibran rakabuming memimpin sidang kabinet paripurna bersama seluruh jajaran kabinet merah putih di kantor presiden jakarta rabu foto humas setkab rah ,netral,32,"['kalinya', 'presiden', 'didampingi', 'wakil', 'presiden', 'gibran', 'rakabuming', 'memimpin', 'sidang', 'kabinet', 'paripurna', 'jajaran', 'kabinet', 'merah', 'putih', 'kantor', 'presiden', 'jakarta', 'rabu', 'foto', 'humas', 'setkab', 'rah']"
 ya gimana ya namanya juga kabinet omon ,negatif,9,"['gimana', 'namanya', 'kabinet', 'omon']"
apresiasi susunan kabinet merah putih komandan tkn fanta arief rosyid hasan prabowo mendorong orang muda sebagai kekuatan ,positif,18,"['apresiasi', 'susunan', 'kabinet', 'merah', 'putih', 'komandan', 'tkn', 'fanta', 'arief', 'rosyid', 'hasan', 'prabowo', 'mendorong', 'orang', 'muda', 'kekuatan']"
 ya kan gamasuk kabinet manapun gmn si,negatif,8,"['gamasuk', 'kabinet', 'manapun', 'gmn']"
 luar biasa kabinet ini bingung pun bisa mendapatkan engagement,negatif,10,"['kabinet', 'bingung', 'engagement']"
kabinet gemuk prabowo tentu akan lebih memperpanjang jangkauan sehingga relatif semua program cepat tercapai tak masalah anggaran membengkak karena pak prabowo akan mengevaluasi kinerja para menterinya,negatif,26,"['kabinet', 'gemuk', 'prabowo', 'memperpanjang', 'jangkauan', 'relatif', 'program', 'cepat', 'tercapai', 'anggaran', 'membengkak', 'prabowo', 'mengevaluasi', 'kinerja', 'menterinya']"
dari kapan tahun di jaman dah berapa penegak hukum dan mentri yg ngomong begini apa hasilnya zonk apalagi sekelas kabinet balas budi macam begini buktikan deh kalau judi online akan tetap subur sampai tahun dari sekarang,negatif,38,"['jaman', 'penegak', 'hukum', 'mentri', 'ngomong', 'hasilnya', 'zonk', 'sekelas', 'kabinet', 'balas', 'buktikan', 'judi', 'online', 'subur']"
 gw demen neh kabinet pancingan sedang berjalan sepertinya,negatif,9,"['demen', 'neh', 'kabinet', 'pancingan', 'berjalan']"
justru koordinasikoordinasi seperti ini akan membuat kabinet baru mengetahui dan melanjutkan policy yang baik ke depannya kan citacitanya sama indonesia emas ujar menteri dody,positif,25,"['koordinasikoordinasi', 'kabinet', 'melanjutkan', 'policy', 'depannya', 'citacitanya', 'indonesia', 'emas', 'menteri', 'dody']"
mengintip peran raffi ahmad di kabinet prabowo ajak masyarakat kolaborasi meski dibayangi kontroversi soal gelar doktornya ,positif,17,"['mengintip', 'peran', 'raffi', 'ahmad', 'kabinet', 'prabowo', 'ajak', 'masyarakat', 'kolaborasi', 'dibayangi', 'kontroversi', 'gelar', 'doktornya']"
 dari kapan tahun di jaman dah berapa penegak hukum dan mentri yg ngomong begini apa hasilnya zonk apalagi sekelas kabinet balas budi macam begini buktikan deh kalau judi online akan tetap subur sampai tahun dari sekarang,negatif,39,"['jaman', 'penegak', 'hukum', 'mentri', 'ngomong', 'hasilnya', 'zonk', 'sekelas', 'kabinet', 'balas', 'buktikan', 'judi', 'online', 'subur']"
 kacau sih ini kabinet anjir belum seminggu udah akh sudahlah,negatif,12,"['kacau', 'kabinet', 'anjir', 'seminggu', 'udah', 'akh']"
sobat nusantara pln nusantara power pln np ikut berkontribusi dalam menyukseskan pelantikan presiden dan wakil presiden serta kabinet merah putih republik indonesia terpilih yang berlangsung pada senin selasa oktober di jakarta ,netral,33,"['sobat', 'nusantara', 'nusantara', 'power', 'np', 'berkontribusi', 'menyukseskan', 'pelantikan', 'presiden', 'wakil', 'presiden', 'kabinet', 'merah', 'putih', 'republik', 'indonesia', 'terpilih', 'senin', 'selasa', 'oktober', 'jakarta']"
 bakal ada reshuffle terus bagus sih daripada kabinet gemuk gitu porsi harus dikurangi eh tapi malah jadi mirip parlementer soalnua ganti ganti terus wkwk,negatif,25,"['reshuffle', 'bagus', 'kabinet', 'gemuk', 'gitu', 'porsi', 'dikurangi', 'eh', 'parlementer', 'soalnua', 'ganti', 'ganti', 'wkwk']"
 wkwkwk yang bener tititfafa kali lu terlalu jauh berimajinasi dengan memakai narasi orang sangat jauh dan diluar nurul baru juga kerja ini kabinet juga udah ada yg bikin gaduh nikmatin dulu lah kasih ruang kudeta hadeehhh emang prabowo kurang pinter apa,negatif,43,"['wkwkwk', 'bener', 'tititfafa', 'kali', 'berimajinasi', 'memakai', 'narasi', 'orang', 'diluar', 'nurul', 'kerja', 'kabinet', 'udah', 'bikin', 'gaduh', 'nikmatin', 'kasih', 'ruang', 'kudeta', 'hadeehhh', 'emang', 'prabowo', 'pinter']"
jajarannya kabinet prabowo klo dijadiin masing satu kantor ruku di summarecon cukup kaga yak,negatif,14,"['jajarannya', 'kabinet', 'prabowo', 'dijadiin', 'kantor', 'ruku', 'summarecon', 'yak']"
perlengkapan tidur yg wajib kamu punya terlaris gt buku prabowo iran ibu supriyani israel baru pecat mentri kabinet fufufafa jokowi ,netral,32,"['perlengkapan', 'tidur', 'wajib', 'terlaris', 'gt', 'buku', 'prabowo', 'iran', 'supriyani', 'israel', 'pecat', 'mentri', 'kabinet', 'jokowi']"
full pidato presiden prabowo di rapat perdana kabinet merah putih program makan gratis dan birokrasi ,netral,20,"['full', 'pidato', 'presiden', 'prabowo', 'rapat', 'perdana', 'kabinet', 'merah', 'putih', 'program', 'makan', 'gratis', 'birokrasi']"
percuma bapak teriak orang di kabinetmu itu loh kabinet balas budi dan campur tangan pak jokowi mereka hanya akan memanfaatkan kebijakan untuk diri dan golongan mereka sendiri bukan untuk kepentingan rakyatmu kita buktikan selama tahun kedepan,negatif,37,"['teriak', 'orang', 'kabinetmu', 'loh', 'kabinet', 'balas', 'campur', 'tangan', 'jokowi', 'memanfaatkan', 'kebijakan', 'golongan', 'kepentingan', 'rakyatmu', 'buktikan', 'kedepan']"
luhut binsar pandjaitan batal pensiun lanjutkan kontribusi di kabinet prabowo subianto ,netral,12,"['luhut', 'binsar', 'pandjaitan', 'batal', 'pensiun', 'lanjutkan', 'kontribusi', 'kabinet', 'prabowo', 'subianto']"
 menteri kabinet prabowo terkaya versi lhkpn nih guys ,netral,10,"['menteri', 'kabinet', 'prabowo', 'terkaya', 'versi', 'lhkpn', 'guys']"
 emang apa hebat nya prabowo bikin kabinet dibantu jokowi padahal akhir masa jabatan tinggalkan beban utk rakyat banyak baca lah biar pinter dikit,negatif,26,"['emang', 'hebat', 'nya', 'prabowo', 'bikin', 'kabinet', 'dibantu', 'jokowi', 'jabatan', 'tinggalkan', 'beban', 'rakyat', 'baca', 'biar', 'pinter', 'dikit']"
biar kembali marwahnya bukan kabinet cengengesan ala mukidi,negatif,8,"['biar', 'marwahnya', 'kabinet', 'cengengesan', 'mukidi']"
fadli zon ungkap prabowo bakal perdalam program rencana dan target kabinet merah putih di akmil magelang artikel ini telah tayang di dengan judul fadli zon ungkap prabowo bakal perdalam program rencana dan target kabinet merah putih di akmil,netral,39,"['fadli', 'zon', 'prabowo', 'perdalam', 'program', 'rencana', 'target', 'kabinet', 'merah', 'putih', 'akmil', 'magelang', 'artikel', 'tayang', 'judul', 'fadli', 'zon', 'prabowo', 'perdalam', 'program', 'rencana', 'target', 'kabinet', 'merah', 'putih', 'akmil']"
 kabinet merah putih red alert ,negatif,10,"['kabinet', 'merah', 'putih', 'red', 'alert']"
 kakaknya jadi pusing lantaran adiknya gak masuk kabinet sementara hasil pansus di depan mata dan penjara menunggu ,negatif,20,"['kakaknya', 'pusing', 'lantaran', 'adiknya', 'gak', 'masuk', 'kabinet', 'hasil', 'pansus', 'mata', 'penjara', 'menunggu']"
menteri kabinet merah putih akan mendapatkan ospek yg dicanangkan oleh presiden republik indonesia prabowo subianto di akmil magelang meanwhile komdis ospek di akmil mana ikat pinggang nya ,negatif,28,"['menteri', 'kabinet', 'merah', 'putih', 'ospek', 'dicanangkan', 'presiden', 'republik', 'indonesia', 'prabowo', 'subianto', 'akmil', 'magelang', 'meanwhile', 'komdis', 'ospek', 'akmil', 'ikat', 'pinggang', 'nya']"
sidang kabinet perdana prabowo tidak patuh dan tidak bekerja keras copot segera ,netral,13,"['sidang', 'kabinet', 'perdana', 'prabowo', 'patuh', 'keras', 'copot']"
 kabinet booby kartanegara masih kosong,netral,6,"['kabinet', 'booby', 'kartanegara', 'kosong']"
 kabinet periode ini sih pak,negatif,7,"['kabinet', 'periode']"
 benar mirip kabinet sibuk klarifikasi quo vadis indonesia ,negatif,12,"['kabinet', 'sibuk', 'klarifikasi', 'quo', 'vadis', 'indonesia']"
prof stella christie akademisi hebat lulusan harvard dan guru besar di tsinghua university kini resmi menjabat sebagai wakil menteri pendidikan tinggi sains dan teknologi dalam kabinet merah putih ,positif,30,"['prof', 'stella', 'christie', 'akademisi', 'hebat', 'lulusan', 'harvard', 'guru', 'tsinghua', 'university', 'resmi', 'menjabat', 'wakil', 'menteri', 'pendidikan', 'sains', 'teknologi', 'kabinet', 'merah', 'putih']"
seru juga disuru tidur jam malem terus bangun jam subuh uda kaya kabinet merah putih,negatif,17,"['seru', 'disuru', 'tidur', 'jam', 'malem', 'bangun', 'jam', 'subuh', 'uda', 'kaya', 'kabinet', 'merah', 'putih']"
harapharap cemas menanti hari kinerja kabinet merah putih prabowogibran ,netral,11,"['harapharap', 'cemas', 'kinerja', 'kabinet', 'merah', 'putih', 'prabowogibran']"
kabinet prerogatif antara prabowo dan joe biden presiden sebagai kepala negara dan kepala pemerintahan punya hak prerogatif dalam mengangkat dan memberhentikan para menteri moch eksan pendiri eksan institute vini najwa shihab padang messi wwii sdit,netral,36,"['kabinet', 'prerogatif', 'prabowo', 'joe', 'biden', 'presiden', 'kepala', 'negara', 'kepala', 'pemerintahan', 'hak', 'prerogatif', 'mengangkat', 'memberhentikan', 'menteri', 'moch', 'eksan', 'pendiri', 'eksan', 'institute', 'vini', 'najwa', 'shihab', 'padang', 'messi', 'wwii', 'sdit']"
presiden prabowo subianto disebut turut memberi pengarahan soal ibu kota nusantara ikn saat retret kabinet merah putih di magelang jawa tengah dan sudah memiliki rencana akan merampungkan pembangunan ikn dalam tahun ,positif,36,"['presiden', 'prabowo', 'subianto', 'pengarahan', 'kota', 'nusantara', 'ikn', 'retret', 'kabinet', 'merah', 'putih', 'magelang', 'jawa', 'memiliki', 'rencana', 'merampungkan', 'pembangunan', 'ikn']"
kabinet prabowo haji isam dan harapan indonesia antikorupsi banyak aspek dan cara untuk mengkajinya izinkan saya menyorotinya dari sisi hukum tata negara dan prinsip antikorupsi denny indrayana exwamenkumham vini najwa shihab padang banda neira,netral,35,"['kabinet', 'prabowo', 'haji', 'isam', 'harapan', 'indonesia', 'antikorupsi', 'aspek', 'mengkajinya', 'izinkan', 'menyorotinya', 'sisi', 'hukum', 'tata', 'negara', 'prinsip', 'antikorupsi', 'denny', 'indrayana', 'exwamenkumham', 'vini', 'najwa', 'shihab', 'padang', 'banda', 'neira']"
tb hasanuddin pembekalan kabinet merah putih yang sakral harus jadi sebuah ikhtiar ,netral,13,"['tb', 'hasanuddin', 'pembekalan', 'kabinet', 'merah', 'putih', 'sakral', 'ikhtiar']"
kata hasto soal tak adanya kader pdip di kabinet merah putih prabowo ,negatif,32,"['hasto', 'kader', 'pdip', 'kabinet', 'merah', 'putih', 'prabowo']"
 dari kabinet sudah menjelaskan semuanya kok,negatif,7,['kabinet']
 kabinet fufufafa kabinet wani piro ,negatif,8,"['kabinet', 'kabinet', 'wani', 'piro']"
kemenpan rb percepat langkah transisi kementrian negara kabinet merah putih menpan rb rini widyantini menargetkan penataan organisasi kabinet merah putih bisa selesai pada akhir november mendatang ten hag preman nikmir hybe vini mudryk manchester united ,netral,37,"['kemenpan', 'rb', 'percepat', 'langkah', 'transisi', 'kementrian', 'negara', 'kabinet', 'merah', 'putih', 'menpan', 'rb', 'rini', 'widyantini', 'menargetkan', 'penataan', 'organisasi', 'kabinet', 'merah', 'putih', 'selesai', 'november', 'ten', 'hag', 'preman', 'nikmir', 'hybe', 'vini', 'mudryk', 'manchester', 'united']"
 cuman satu ganti wakilnya buang semua liyalis mulyono di kabinet yakin amamn dan sejahtrapoinya adalah berani engga,negatif,19,"['cuman', 'ganti', 'wakilnya', 'buang', 'liyalis', 'mulyono', 'kabinet', 'amamn', 'sejahtrapoinya', 'berani', 'engga']"
 isi kabinet kebanyakan penjilat daripada patriot,negatif,8,"['isi', 'kabinet', 'kebanyakan', 'penjilat', 'patriot']"
 gak cuma presiden aja yang peduli sama rakyat para menteri kabinet indonesia maju juga ikut antar semangat,positif,18,"['gak', 'presiden', 'peduli', 'rakyat', 'menteri', 'kabinet', 'indonesia', 'maju', 'semangat']"
 tauketauke besar itu artinya oligarki mr anwar indonesia justru sarangnya di kabinet merah putih,negatif,16,"['tauketauke', 'oligarki', 'mr', 'anwar', 'indonesia', 'sarangnya', 'kabinet', 'merah', 'putih']"
 bener berani teriak kenceng bro skrg kabinet nmbh orang gmn bro dgn uang apbnitu ada mentri yg minta tmbhan t udah teriak kenceng blom loe bro,negatif,29,"['bener', 'berani', 'teriak', 'kenceng', 'bro', 'kabinet', 'nmbh', 'orang', 'gmn', 'bro', 'uang', 'apbnitu', 'mentri', 'tmbhan', 't', 'udah', 'teriak', 'kenceng', 'blom', 'loe', 'bro']"
 terus dgn kabinet di tmbh pkai acara gt apa gk pkai uang apbn mnggaji orang gk pkai uang apbn rakyat mau di cekik dgn pajak yg tinggi gt,negatif,32,"['kabinet', 'tmbh', 'pkai', 'acara', 'gt', 'pkai', 'uang', 'apbn', 'mnggaji', 'orang', 'pkai', 'uang', 'apbn', 'rakyat', 'cekik', 'pajak', 'gt']"
 anies gak di kabinet itu yowis ini prabowo fufufafa kalau udah seminggu aja ngawur begini sampe bilang aksi bukan pelanggaran ham gimana tahun kedepan ,negatif,28,"['anies', 'gak', 'kabinet', 'yowis', 'prabowo', 'udah', 'seminggu', 'ngawur', 'sampe', 'bilang', 'aksi', 'pelanggaran', 'ham', 'gimana', 'kedepan']"
tapi nilai plusnya emang benar pramono mengetahui seluruh informasi dan pembangunan selama menjadi sekretaris kabinet pengetahuan nya selama ini ketika memaparkan visi dan misi cukup menjadi perhatian sepertinya faktor inilah yang menaikan elektabilitas pramono not dari rkarno,positif,37,"['nilai', 'plusnya', 'emang', 'pramono', 'informasi', 'pembangunan', 'sekretaris', 'kabinet', 'pengetahuan', 'nya', 'memaparkan', 'visi', 'misi', 'perhatian', 'faktor', 'menaikan', 'elektabilitas', 'pramono', 'not', 'rkarno']"
 mbl yg ada tetap dipki sdg yg tdk py mbl aj hemat anggaran ganti kabinet ganti mbltdk gt jg biasakan,negatif,21,"['mbl', 'dipki', 'sdg', 'py', 'mbl', 'aj', 'hemat', 'anggaran', 'ganti', 'kabinet', 'ganti', 'mbltdk', 'gt', 'biasakan']"
cengkraman jokowi di kabinet prabowo tak berdaya mengusung tema keberlanjutan postur kabinet merah putih prabowo dipastikan tidak lepas dari bayangbayang joko widodo vini najwa shihab padang asupan banda neira,negatif,30,"['cengkraman', 'jokowi', 'kabinet', 'prabowo', 'berdaya', 'mengusung', 'tema', 'keberlanjutan', 'postur', 'kabinet', 'merah', 'putih', 'prabowo', 'lepas', 'bayangbayang', 'joko', 'widodo', 'vini', 'najwa', 'shihab', 'padang', 'asupan', 'banda', 'neira']"
rocky gerung prediksi minggu prabowo lakukan reshuffle kabinet vini ,negatif,11,"['rocky', 'gerung', 'prediksi', 'minggu', 'prabowo', 'lakukan', 'reshuffle', 'kabinet', 'vini']"
 makin banyak partai ri akan kembali ke kabinet syafrudin,negatif,10,"['partai', 'kabinet', 'syafrudin']"
dukung pemerintahan prabowogibran anas urbaningrum ingatkan kabinet gemuk bekerja untuk perbaiki hidup rakyat lewat ,positif,20,"['dukung', 'pemerintahan', 'prabowogibran', 'anas', 'urbaningrum', 'ingatkan', 'kabinet', 'gemuk', 'perbaiki', 'hidup', 'rakyat']"
wah kaudua kali pulang duluan diacara rapat kabinet retreat akmil kok pulang duluan sdg pak presidennya msh disana ini benarkh aduhgibran kau wapres ri skrg kami rakyat butuh tuntunan dari kepemimpinanmu sbgai contoh ,negatif,36,"['kaudua', 'kali', 'pulang', 'duluan', 'diacara', 'rapat', 'kabinet', 'retreat', 'akmil', 'pulang', 'duluan', 'sdg', 'presidennya', 'disana', 'benarkh', 'aduhgibran', 'kau', 'wapres', 'rakyat', 'butuh', 'tuntunan', 'kepemimpinanmu', 'sbgai', 'contoh']"
kekayaan menteri di kabinet prabowo ,negatif,7,"['kekayaan', 'menteri', 'kabinet', 'prabowo']"
pemisahan kementerian desa pembangunan daerah tertinggal dgn kementerian transmigrasi di kabinet merah putih sebagai salah satu upaya pemerintahan prabowo gibran dlm mewujudkan peningkatan dlm sektor perekonomian ten hag hybe vini mudryk manchester united ,netral,37,"['pemisahan', 'kementerian', 'desa', 'pembangunan', 'daerah', 'tertinggal', 'kementerian', 'transmigrasi', 'kabinet', 'merah', 'putih', 'salah', 'upaya', 'pemerintahan', 'prabowo', 'gibran', 'mewujudkan', 'peningkatan', 'sektor', 'perekonomian', 'ten', 'hag', 'hybe', 'vini', 'mudryk', 'manchester', 'united']"
 terserah mau pake duit negara mau pake duit pribadi yg penting berani gak depak fu fa amp bersihin kabinet dari org mulyono,negatif,22,"['terserah', 'duit', 'negara', 'duit', 'pribadi', 'berani', 'gak', 'depak', 'fu', 'fa', 'amp', 'bersihin', 'kabinet', 'org', 'mulyono']"
kemenpanrb percepat langkah transisi kementerian negara kabinet merah putih guna menjaga keberlangsungan pelaksanaan tugas dan fungsi sumber daya manusia aset anggaran ten hag preman nikmir hybe vini mudryk manchester united ,netral,33,"['kemenpanrb', 'percepat', 'langkah', 'transisi', 'kementerian', 'negara', 'kabinet', 'merah', 'putih', 'menjaga', 'keberlangsungan', 'pelaksanaan', 'tugas', 'fungsi', 'sumber', 'daya', 'manusia', 'aset', 'anggaran', 'ten', 'hag', 'preman', 'nikmir', 'hybe', 'vini', 'mudryk', 'manchester', 'united']"
dipimpin luhut ini tugas dewan ekonomi nasional di kabinet merah putih prabowogibran ,netral,13,"['dipimpin', 'luhut', 'tugas', 'dewan', 'ekonomi', 'nasional', 'kabinet', 'merah', 'putih', 'prabowogibran']"
