Tweet,Sentimen,Tweet Length
  Bangkai busuk seperti Fufufafa yang mulai berulat dan akan siap merusak kabinet Prabowo seperti sulit untuk diabaikan begitu saja Apa lagi sang penguasa akan melakukan perjalanan ke LN,negatif,30
 Semestinya yang di tangkap yang nyata2terbukti korupsi uang rakyat para menteri2nya Jokowi yg sekarang bercokol di kabinet Prabowo belum lg perbuatan fufufafa yg menghina sanasini itu sebenarnya yg di tangkap bukn Tom Lembong krn kebijakan impor gula itupun atas perintah Jokowi,netral,42
 Menteri pertama dalam list reshuffle Kabinet Merah Putih,negatif,9
  Era niku mentri2 kabinet pembangunan V apal,negatif,9
  Ini orang suka koar waktu masa Jokowi kini tak koar lagi karena udah masuk Kabinet ,negatif,17
  Kaya nya isi Kabinet Menteri2 nya Pak  wong e aneh2 Semoga Indonesia tambah maju  Merdeka ,negatif,20
Fungsi Giring sebenernya dimasukin ke kabinet ngehemat budget hiburan,negatif,9
 Ibarat harga rumah 30M biaya pengerajaan bangun rumahnya 48 M Ada 10 Pigai di kabinet menuju Indonesia bangkrut,negatif,19
 dia ini preman bukan politisi apalagi negarawan inilah seken kabinet kabinet barang rongsok,negatif,14
 he said timbul tenggelam bersama rakyat  tp setelah memprovokasi pendukungnya sampe jatuh korban jiwa dia malah masuk kabinet dan ga pernah sekalipun menjenguk korban dan keluarganya so what do you expect guys ,negatif,34
  Jangan masuk angin lo kejagng  ini jelas udah ada indikasi kerugian negara malah pada masuk kabinet,negatif,19
  Kalian itu gaada bedanya erina dan najwa aja dibully abis2an pokoknya pendukung capres manapun kek taik semua ketikannya jahat dan berantem mulu padahal yg di atas bagi2 jabatan cawapres 01 aja masuk ke kabinet kalian ga sadar Kalian cuma jd kambing hitam politik doang ,negatif,46
   Kalian itu gaada bedanya erina dan najwa aja dibully abis2an pokoknya pendukung capres manapun kek taik semua ketikannya jahat dan berantem mulu padahal yg di atas bagi2 jabatan cawapres 01 aja masuk ke kabinet kalian ga sadar Kalian cuma jd kambing hitam politik doang ,negatif,47
 Parah banget Merak  Bakauheni jadi Rp 998500  ugalan blm ada Sebulan Pemerintahan Kabinet Gemoy harga ikut naik gemoy Baru beberapa hari lalu gw nyebrang masih Rp 750000  Ayo rakyat di perah tuk bayar gaji kabinet gemoy,negatif,40
 Yoi u know kan kabinet maling asal pesanan bungkusssss  ,negatif,12
MAYJEN PURN SOENARKO SANGAT MENDUKUNG KABINET MERAH PUTIH PEMERINTAHAN PRESIDEN PRABOWO KEMAJUAN INDONESIA DAM DEMI PELAYANAN YANG TERBAIK UNTUK MASYARAKAT ,positif,21
  Saya menyatakan tidak lanjut sejak sblm kabinet dibentuk Itu murni keputusan saya pribadi Apakah tidak terpakai lagi Bisa ya atau tidak saya tidak tahu dan bukan lagi urusan saya,negatif,31
 Pastinya Harus membereskan kebobrokan rezim lamaplus mengatur komposisi kabinet yang pas dan tepat,negatif,14
KABINET OMON FUFUFA DITANGGAPI NEGATIF PASAR RUPIAH AMBRUK 15700 EKONOMI SULIT BANGKIT Kabinet hanya dijadikan penampungan buzer Dominasi buzer fufufafa pro Jokowi di kabinet akan mempercepat kehancuran negara dan merusak keuangan negara dst NA Haryokusumo NATION RESEARCH ,negatif,38
 makanya itu Ya Allah itu Paspamres kerja extra keras loh Kemarin kan yg aktif Presiden saja kali ini Presiden dan Wakil Presiden cus langsung kerja Mudahmudahan Pak Presiden Wakil Presiden kabinetkabinetnya dan Paspamres sehat semua  Ketarketir juga aku,negatif,40
Jakarta  Menteri Hukum Supratman menghadiri Rapat Kerja Raker bersama Komisi XIII Dewan Perwakilan Rakyat DPR Republik Indonesia Senin 4112024 Ini merupakan rapat perdana Menteri Hukum bersama DPR sejak dibentuknya Kabinet Merah Putih oleh Presiden Prabowo Subianto ,netral,38
3 Pohon dan Keberlanjutan Sumber Daya Alam 4 Pohon sebagai penyedia Oksigen      Himbio FMIPA Unpad 2024 Dewan Pengurus XLV Kabinet Neuron,netral,26
 Kalau indikasi korupsi pejabat di era Jokowi dibiarkan malah yg terindikasi korupsi masuk kabinet lagi bagaimana bisa bentuk pemerintahan yg bersih,negatif,22
Kabinet bermasalah di mulai dari pemilihnya yang bermasalah,negatif,8
Ehkeknya setelah nyadar usahanya gagal mulu mulai banting stir si doikemaren udah posting 2x berfoto ama mentri Kabinet Merah Putih,negatif,20
 RAJA JAWA PUKIMA PKI  Wajib di TANGKAP dan di HUKUM MATI KABINET SAMPAH Prabowo adalah Kelanjutan dari Program Jokowi dan Antekanteknya Globalist Kafir  Komunis Tujuan nya Hanya Satu  Menjadikan Indonesia negara Komunis   ,negatif,39
 Mau perombakan kabinet  Awokwokwokwok,negatif,6
  Reaksi pasar yg cenderung negatif Apakah krn sentimen negatif thd susunan kabinet atau kondisi aktual ekonomi yg tidak sehat pak,negatif,22
  ini Sampah yang tidak layak masuk dlm Kabinet    mereka Semua PENGKHIANAT BANGSA yang Sangat ANTI ISLAM Kabinet PRABOWO adalah KABINET PKI yg Melanjutkan Program Raja Jawa PUKIMA  Bangsat ,negatif,35
 Setiap hari ngomong pemerintahan yang bersih namun di kabinet bercokol banyak penyamun semua akan jadi omonomon,negatif,17
 kalau dia berkicau setengah kabinet masuk bui kayaknya ,negatif,9
 Tak Berkutik Kejagung Bongkar Korupsi Besar Dirjen Kemenhub Terseret Kasus Jalur Kereta Api BesitangLangsa              ,negatif,28
Bravo Kabinet Merah Putih Presiden Haji Jenderal TNI AD PS bin SD ,netral,13
 Jokoei itu kan suhunya prabowopernahkan prabowo bilang bahwa moelyono itu kan gurunya Tampak nya jokwi pegang kendali si prabowo Kabinet ini akan timpang jalannya dan semua itu pasti kendalikan moelyonoknp prabowo tidak sowan ke ESBEYEmantan presiden yg kharismatik ,negatif,40
 natalius pigai agen uganda yang disisipkan ke kabinet prabowo,negatif,10
 Bentar lg masuk kabinet ,negatif,5
   iyaa bangg gw setujuuu prabowo udh ngebantu tp emg krna dia pnya parpol bang trus gt ga boleh nyapres gt kalo dibantu ha dan ga minta dibantu juga kann lu ngata2in org aja ga logis dahh gituan lu anggap penghianat penghianat tuh kalo kalah trus malah masuk kabinet,netral,51
  Kita lihat ajh apakah kabinet nya pa  akan menyapu bersih para pengkhianat atau malah sebaliknya  Hanya Tuhan yg tau,negatif,23
Tekad Presiden Prabowo yang disampaikan saat pelantikan Kabinet Merah Putih untuk mewujudkan swasembada pangan dalam tempo sesingkatsingkatnya layak diapresiasi ,positif,20
 Duitnya dapat ngutang sama hasil pajak diluar nurul sementara pejabatnya bukannya diirit tapi dimanja dengan duit Kabinet aja bengkak pemborosan anggaran,negatif,22
 Omongan sampah pantes aj ga masuk kabinetupsss sekolah aj do gimana mo jadi pejabat publik,negatif,16
Sekretaris Fraksi Golkar DPR RI Mukhtarudin mendorong bahwa kabinet MerahPutih Prabowo Subianto untuk terus memperkuat komitmen untuk menciptakan masa depan yang lebih hijau dan berkelanjutan melalui berbagai langkah strategis demi mewujudkan kemandirian Energi nasional ,positif,35
  KOMUNITAS KRIMINAL DLM NEGARA BIKIN KABINET KRIMINAL ,negatif,10
Bagi yang kemaren nonton siaran live deklarasinya ini tuh diperuntukkan kepada para kabinet kementerian bukan rakyat Jangan baca headline doang makanya ,negatif,21
GUA TIDAK YAKIN DENGAN KABINET MERAH PUTIH MANUSIA JUJUR 100 PERSENKARNA BATIN GUA LIAT MANUSIA NYA ITU SAJA,negatif,18
  sok ngeritik tlol biar apa biar di ajak msuk kabinet wokwkwk  org kek lu cocok ny JD buzzer aja mbk cocok,negatif,24
 Ya emang bisanya itu Mau pimpin rapat kabinet jg udah pasti nol,negatif,13
Siap Terima kasih kepada presiden dan segenap kabinet lembah twitter yang telah memberi mandat kepada saya sebagai ketua partai rebahan Dengan ini saya akan menerimanya dengan senang hati Hormaaaaaaat graaak,negatif,30
 Ya pasti yakin lah kan KABINET FUFUFAFA iya kan,negatif,10
 Dengan personil yang dipilih mengisi kabinet rasanya tidak mengagetkan pak,negatif,11
 Gw mikirny Prabowo bkin kabinet gemuk biar bsa menampung smua relawan pilpres Prabowo ga kepikiran buat bagi2 kue di BUMN ehhh taunya sma aja Gma BUMN kita bisa maju klo di isi Ama politikus2simpatisan pilpres,netral,36
   2 titipan udah masuk kabinet,negatif,8
 Temen saya  mau buat bahan riset kabinet,netral,9
Pernah Menteri kehutanan di masa SBY Menteri Perdagangan di Masa Jokowi sekarang Menko Pangan di Kabinet Merah Putih Pak Zulhas 2028 sdh didepan mata jgn terlalu yakin swasembada sementara puluhan tahun itu hanya sebatas mimpi n agenda pencitraan Apa anda mau mengulanginya ,netral,43
 Kok sekretaris kabinet kerjaannya ngecek makanan presiden,negatif,8
          Masa iya sihhtapi dengar2 mentri kabinet merah putih yg di angkat prabowo itu 90 adalah koruptor,negatif,26
  iming2 apa bapak ini smpe ngebela keluarga rakus udah di janjiin bakal masuk kabinet pemerintahan kah ,negatif,18
Ini penyebabnya Knapa Pak PS tidak Full Power gas di Kabinet Pertama terbentuk Boleh bermimpi sih Kita akan Punya Kualitas Pemimpin yang Hebat Tapi kayanya merayap dan tertatih tatih Karena itulah bolak balik Solo ,negatif,35
  Biarin ajanamanya juga kabinet curang,negatif,7
Isu Mimpi Menteri Agama sudah arah Dato Nooh Gadut amp Jakim jawab Tulisan ini yg diarahkan kepada kabinet PMX saya harap Menteri Agama tidak cuci tangan dan arah org lain pula jawab Dilantik Menteri Kabinet ambik risiko jawab sama Tuduhan ni sgt berat,netral,43
TERKINI  Pesawat khas membawa Perdana Menteri Datuk Seri Anwar Ibrahim tiba di Lapangan Terbang Antarabangsa Shanghai Hongqiao pada pukul 950 malam waktu tempatan diiringi beberapa menteri kabinet  Foto Sadiq AsyrafPMO ,netral,33
  Toti karbitan 303 masih berkuasa di kabinet ,negatif,9
 Biar Fair buat aturan mantan presiden dan wakil tidak boleh menerima kunjungan presiden dan wapres serta menteri yang ada di kabinet yg baru jjuga tidak boleh menerima kunjungan calon yg maju di Pilkada utk hindari prasangka buruk ke mantan presiden dan wakilnya,negatif,43
 Tenang toti karbitan masih berkuasa di kabinet ,negatif,8
Hari berganti tetapi pedang dan tombak kepemimpinan takkan pernah mati Saya Adhimas Daru Dhiulhaq sebagai Kabid Internal telah melewati tujuh hari untuk menempa anggota BEM USB 2024 KABINET ARU CANDRASA menjadi penerus perjuangan dan penggerak demokrasi HIDUP MAHASISWA ,netral,39
  Hari berganti tetapi pedang dan tombak kepemimpinan takkan pernah mati Saya Jahwani Gandamana sebagai Kabid Eksternal telah melewati tujuh hari untuk menempa anggota BEM USB 2024 KABINET ARU CANDRASA menjadi penerus perjuangan dan penggerak demokrasi HIDUP MAHASISWA   ,netral,42
  Begini klo nga dapat jatah kursi kabinet ngoceh aja kerjaan mereka,netral,13
Pesantren Kilat Akmil Anggota Kabinet MP2024 Angkatan I,netral,8
 pembersihan kabinet dari oknum korup yaiyaiyabrarti banyak nih yg keciduksemoga bgt adanya,negatif,13
urusan gula itu sudah diproses sejak sebelum pilpres untuk judol ini baru terungkap setelah adanya penangkapan pembina judol yang menindak keduanya adalah kejaksaan dipihak yang sama sepertinya tidak ada drama gertak ini cuma proses pembersihan kabinet dari oknum Korup,netral,39
ADA KERETAKAN DALAM KABINET SATU DUA PEKAN KE DEPAN ADA RESHUFFLE  via ,negatif,14
Kabinet Merah Putih  Jadi ingat paman MK,negatif,8
Baru hitungan jam kabinet Wowo udah menggemparkan,negatif,7
 Membersihkan kabinet sama saja membuka aib sendirikecuali melakukan ott korupsi baru resafle Umumnya rezim hny janji madu diawal selebihnya y rasa pait empedu bg rakyat,negatif,26
PRABOWO TAK UNDANG KAESANG RAPAT KETUM PARPOL BERIKUTNYA TAK UNDANG GIBRAN RAPAT KABINET Prabowo tak undang Kaesang done Berikutnya Prabowo tidak mengundang Wapresnya Gibran pada rapat kabinet Ini belum terjadi Mungkin ini penerawangan dokter Tifa Bisa juga prediksi,negatif,38
   orang2 baik sedikit dan susah masuk kabinet menteri,negatif,11
 pak yg pertama up 15 yg kabinet 12 nambah kepala nambah fee lg 4k an,negatif,16
Kabinet omon isinya para koruptor Wkwkwk,negatif,6
Ratu Spanyol smp berkotor2 penuh lumpur rela dikata2in rakyatnya meanwhile kabinet pemerintahannya pada gak tanggung jawab and kabur,netral,18
Pembicaraan Kucing dan Pare Kucing Anak buah Bapak ada yang kesenggol operasi Apa perlu diperiksa Pare Jangan nanti kabinet Bapak kena Kucing Meoooonnnggg   ,negatif,26
  Emang atas dasar apa kabinet sekarang nuduh korupsi emang punya data komplet Klw anda punya datanya tunujukan k publik siapa2 aja yg korupsi jgn tongkosong nyaring bunyi,negatif,29
 Orang partai wkwkwkwkw makin kocak aja ni kabinet,negatif,9
 Presiden Prabowo Subianto melakukan kunjungan kerja perdananya ke luar kota pada Minggu 3112024 Daerah pertama yang dikunjungi adalah Kabupaten Merauke di Papua Selatan Dalam kunjungannya Presiden Prabowo meninjau langsung proses tanam dan panen padi dalam ,positif,37
 Indonesian minor celebrity yang mungkin kalo gak di blow up kemarin akan masuk ke jajaran kabinet utama presiden baru Jadinya masuk ke utusan khusus,negatif,24
 Bener dugaan gua Prabowo itu lanjutan Mulyono kepergian dia keluar negeri semacam latihan buat ffff mimpin sidang kabinet dan membuat keputusan strategis,negatif,23
 Wkwkwk bargaining kabinet yang sekarang,negatif,6
Presiden Prabowo Subianto menerima surat kepercayaan dari 7 Duta Besar Luar Biasa Berkuasa Penuh LBBP negaranegara sahabat di Istana Merdeka Jakarta Senin 04112024 Penyerahan surat kepercayaan ini sekaligus menandai dimulainya penugasan resmi para duta besar di ,netral,37
  D121  Debat ga penting si kocak lu,negatif,9
SINI IKUT GRUP SAYA supaya kamu tidak bisa kemanamana ,negatif,10
Sekretaris Fraksi Golkar DPR RI Mukhtarudin mendorong bahwa kabinet MerahPutih Prabowo Subianto untuk terus memperkuat komitmen untuk menciptakan masa depan yg lebih hijau dan berkelanjutan      ,negatif,31
 Prabowo banyak sekali yg korup di kabinet mu anda bakal berhadapan dgn netizen,negatif,14
Kementerian Kebudayaan baru di Kabinet Merah Putih dilantik Pelaku seni dan budaya harapkan hal ini via detikPop ,netral,18
Bapak Budi Arie Setiadi MENKOMINFO Kabinet Indonesia Maju selalu memberikan atensi p3r4ng m3l4w4n Jud 0nln3 dan Memastikan Keberlanjutan pada Kabinet Bapak Prabowo yang saat ini dijabat oleh Bu Meutya Hafid KOMDIGI PROJO MUDA Muda Mengabdi Mendunia   ,positif,39
Orator di Aksi 411 90 Menteri yang ada di kabinet saat ini adalah koruptor semua  Termasuk Budi Arie  ,negatif,21
 Gmn mau diterima masuk kabinet kalo kelakuan buzzer gini Udh mahasiswa goblok kuliah 9 thn ga lulus Sok komenin org yg mungkin kuliah 3 5thn aja dah kelar bahkan s2 s3 Lah si  s1 aja ga lulus,negatif,39
 Mental dan karakternya yg dibenahi pak  pemenuhan materi tidak akan ada cukupnya  jika melihat acara pelantikan kabinet kemarin dengan membawa istri masing2x kelihatan menjadi ajang flexing tas yg dibawanya ,negatif,33
   Jangan munafik pak jadi staf khusus menhan kan lumayan sambil menunggu reshuffle 100 hari kabinet,negatif,18
 Maju untuk kepribadian nya Memperkaya diri sendiri Menjijikan amat kabinet kepemimpinan di isi sama manusia2 rakus,negatif,17
Rapat dg   Di akui Alokasi Kuota Haji adh   Kabinet 20192024  cmana nih Yakult  Cc           ,netral,31
  Ini orang gila Masak pak  memelihara orang gila di kabinet,negatif,13
  1 Orang NAIF yg percaya Prabowo mau pemerintahan bersih dengan BENAHI SISTEM 2 Pidato2nya memang menjanjikan  Prakteknya Kabinet diisi MISFITS amp MISMATCH dan orang2 terindikasi TIDAK BERSIH 3 Emangnya Indonesia bisa dibersihkan cuma dng pidato2,negatif,38
   Selama geng caplin ga bisa masuk kabinet ya gosok terus adu domba ,negatif,15
 Kita sudah mendapat arahan Bapak Menteri bahwa pada Era Kabinet Merah Putih ini adalah era pengendalian yang akan mendominasi pekerjaan Jadi tata ruang dan pengendalian sebagai panglimanya pertanahan saat ini,positif,30
Daerah pada Kamis 31102024 di Hotel Sutasoma Jakarta Kegiatan ini dibuka langsung oleh Direktur Jenderal Dirjen PPTR Jonahar yang menyampaikan arahan terkait tugas pengendalian dan penertiban di Era Kabinet Merah Putih,netral,31
Kementerian Kebudayaan baru di Kabinet Merah Putih dilantik Pelaku seni dan budaya harapkan hal ini via  ,netral,18
Komisi II Dewan Perwakilan Rakyat Republik Indonesia DPR RI untuk pertama kalinya Rapat yang membahas Target dan Capaian Tahun Anggaran 2024 serta Program 100 Hari Kerja Kabinet Merah Putih ini digelar di Gedung Nusantara DPR RI Jakarta pada Rabu 30102024,netral,40
 Suasananya lebih dahsyat daripada reshuffle kabinet ,negatif,7
Gelar Evaluasi Hasil Pengawasan dan Pengendalian Hak Atas Tanah Dirjen PPTR Sampaikan Tugas Pengendalian dan Penertiban pada Era Kabinet Merah Putih Cek berita selengkapnya     ,netral,29
 Design by nazwa Caption by sunia Uploaded by rai Himpunan Mahasiswa Sastra Arab 2024 Kabinet ElIttihad Departemen Penalaran Intelektual,netral,19
Selamat atas prestasi yang menginspirasi Semoga terus menginspirasi dan membawa nama baik Sastra Arab ke kancah nasional Design by shafira Caption by Salma Lutfiah Uploaded by rai Himpunan Mahasiswa Sastra Arab 2024 Kabinet ElIttihad Departemen Hubungan Internal,netral,37
 Kabinet dan lembaga negara bapak gemukkan berarti anggarannya banyak kesedot kenapa sekarang bapak minta orang sisihkan Rp 100 rbbulan untuk seragam ambil saja dari makan siang gratis,negatif,28
  Mestinya mentrinya yg dulu di Keluarkan aja dari kabinet Prabowo bikin Malu dan Bikin Rusak Negara ini,negatif,19
Dia positif dia Akan bantu membawa Perkara ini ke Mesyuarat Jemaah Kabinet pada Rabu ini Kita berdoa dan berharap jangan lah Sabah dibiarkan bergelap pada Januari 2025,netral,27
Menteri ATRBPN Nusron Wahid bersama Wamen ATRBPN Ossy Dermawan mengikuti Raker Bersama Komisi II DPR RI untuk pertama kalinya Rapat yang membahas Target dan Capaian Tahun Anggaran 2024 serta Program 100 Hari Kerja Kabinet Merah Putih ini digelar di Gedung Nusantara DPR RI ,netral,44
Kabinet MerahPutih Prabowo Subianto untuk terus memperkuat komitmen utk menciptakan masa depan yang lebih hijau amp berkelanjutan melalui berbagai langkah strategis demi mewujudkan kemandirian Energi nasional     ,positif,31
Mengingat dia melanjutkan beberapa menteri dari Jokowi juga ditarik dalam Kabinet Merah Putih,netral,13
Selain itu Hendri tak menutup kemungkinan Prabowo juga melaporan pekerjaan di Kabinet,netral,12
Sekretaris Fraksi Golkar DPR RI Mukhtarudin mendorong bahwa kabinet MerahPutih Prabowo Subianto untuk terus memperkuat komitmen untuk menciptakan masa depan yang lebih baik       ,positif,30
   Betul jangan sampai STAMPLE KABINET LANJUTAN DAN KEBIJAKAN LANJUTAN UNTUK MEMBUNGKAM LAWAN POLITIK SEMAKIN NYATA TERLIHAT,negatif,19
 Yang MENTAL KULI  MINGGIR   Mereka SUDAH TERKENAL dan SUKSES sebelum masuk kabinet ,negatif,17
Kalau DiIndonesia Kalau Tim Pemenangan Seperti Kamu Itu Elon Musk Sudah Duduk DiKursi Kabinet Apakah Kamu Juga Seperti Itu Elon Musk Akan Diangkat Donald Trump NantiX Ikut Gabung DiKursi Parlemen ,netral,30
  Mending hokage ngegaji kabinet gemuknya n mending kasihdepeer uangtambahan tunjangan 50jt Wkwkwkw,negatif,14
Kalo mainnya aturan menteri di kabinet terduga korupsi di copotin ada Airlangga Zulhas Dito siapa lagi,negatif,16
Padahal kabarnya ini kabinet super kuat Mayoritas kekuatan ada disini Saya menyebutnya Kabinet Kaki Tiga karena ini adalah penyatuan tiga kekuatan  TNIPolri  Oligarki dan Parpol  Kaum Kiri,negatif,30
KABINET TIGA KAKI YANG RAJIN MENGELUH   Kabinet Gemoy yang baru dilantik belum sebulan lalu sudah mulai bekerja Dan untuk saya yang menarik adalah bahkan sebelum mulai bekerja beberapa diantara mereka sudah mulai kerja besar yakni berkeluh kesah,negatif,39
           Nah klo yg ini gua sependapat ini yg termasuk salah 1 orang yg gua kritisi jd menteri kabinet merah putih,negatif,31
  Pak  yg namanya bantu itu ga ada yang gratis Dibalik itu mereka ada kepentingan Jangan sampai kami dikorbankan Tolong stop berhutang sama china N juga stop juga TKA asing cina ke indonesiaTangkap para koruptor dilingkaran kabinet merah putih Dan stop contact jokowi,negatif,45
aduh salting bgt gw gulingin juga nih kabinet pemerintahan damn bro ngucapin pepero day in a very cutesy way mules ,negatif,21
 YOURS IS WAY BETTERRRRRRRR makasih sudah jadi menteri di kabinet nrhs ya ajas sangat beruntung sekali bisa bekerjasama dengan anda membangun negeri nrhs indo ,negatif,25
Semiotika zaken kabinet setelah difahami oleh banyak pihak justru diabaikan oleh presiden Prabowo Mengangkat orang yang tidak memiliki kompetensi Salah satu adalah Budi Ari lanjutkan menurut anda siapa saja,negatif,29
Bukti tahun 2022 sempet nemenin penyerahan petisi ke Asisten Deputi Bidang Sumber Daya Mineral dan Lingkungan Hidup Sekretariat Kabinet Bapak Troeno Marayoga SH LLM Ntah sekarang beliau masih di Setkab gak ya hehehe ,negatif,34
 Prabowo menguasai 3 pemerintah Eksekutif legislatif yudikatif didukung oleh rakyat yang luar biasa Senjata politik beliau menguras para politik tikus Orang orang nya di kabinet bekerja full time untuk swasembada pangan dan energi ,positif,34
 Bingung gue lihat ini orang bicarayg anda bilang itu semua rakyat udah fahamsemua kabinet itu banditlalu kita rakyat harus bagaimanakita udah di buat bungkam oleh aparat yg tlah di seeting,negatif,31
Presiden Prabowo komit membangun sistem antikorupsi dan pemberantasan korupsi Tapi apakah Pak Presiden tak sadar dengan formasi kabinet yang di dalamnya memiliki rekam jejak korupsi Ulasan Achmad Zainuddin ,negatif,29
   Semoga kabinet Merah Putih smakin solit,positif,9
Semoga info ini benar Kalau benar terima kasih Presiden  dan staf kabinet terkait ,positif,15
 Dilihat dari kasus 2 wapres sebelumnya emang ada gebrakan di strategic work Kalau gue melihat nya Ini hanya sebuah sarana pengaduan masyarakat Yang pake nama wapres aja Yang gerak ya orang orang bawahan juga Gak bakal sampe Ratas kabinet ,negatif,40
 makin terpuruk tidak ada yg bisa dibanggakan dari kabinet jastip si wowo udah dibayangbayangi siwiwi beban si samsul skrg malah ngemis minta cina ikutan mendanai makan siang gratis,negatif,29
Emang kerusakannya sdh parah nih bangsa Berat juga pak   dg anggota kabinet titipan Hari Mulyono Tersangka malah dijdkan Duta Tentu ada uang sakunya ,negatif,26
  Pak Presiden RI  Seluruh rakyat sepakat mendukung Bapak dgn komitmen kabinet merah putih Hanya perlu diwaspadai jangan terseret arus pertanggungan Pemerintah lalu dgn kabinet oligarki Jangan jadi satria wirang Biar rakyat yg menilai,negatif,36
 Di filling Kabinet isianya duit warna merah semuagila para pejabathukum mati,negatif,12
 harusnya yg harus satu Visi dan Misi dgn Presiden adalah para Menteri Kabinet Merah Putih kl kepala Daerah Hrs satu Visi Misi dgn Presiden mk UU Nomor 32 Th 2004 ttg Otonomi DaerahHARUS di cabut dl ,negatif,38
Harusnya sih tak ada warga miskin di Indonesia lihat seluruh kabinet terisi uang semua Hayo buruburu cari air cari lap yg bersih,negatif,22
Kalian kalian yang udah keluar dari kabinet Indonesia maju kalian semua anggota kabinet merah putih kalian di denda 20 trilyun perorang karna anda melanggar aturan negara jangan protes itu fakta HMM ,negatif,32
 Yth  pak  Ternyata tugas pak  yang paling utama sbg presiden RI adalah menemukan obat GEBLEK terkhusus untuk para pejabat di jajaran kabinet pak Prabowo sendiri,negatif,29
Tema ini melambangkan semangat kebangsaan yang kuat mengajak untuk bersatu menjaga identitas nasional amp memperkuat rasa cinta terhadap Tanah Air Seluruh rangkaian upacara diikuti dengan khidmat oleh seluruh peserta termasuk para Menteri amp Kepala Lembaga Kabinet Merah Putih,negatif,38
 Bapak Presiden dalam programnya mempunyai visi misi disebut Asta Cita Kabinet Merah Putih Di dalam Asta Cita ini yang ada kaitannya dengan tanah adalah swasembada pangan yaitu menetapkan sistem pertahanan dan mendorong kemandirian bangsa melalui swasembada pangan amp energi,positif,39
 Bermula dri kabinet yg korupsi,negatif,6
Perjalanan 100 Hari Kerja Kabinet Merah Putih Direktur P3S Ada Empat yang Menunjukkan Kompetensinya via  ,positif,17
 Bagai kuman di seberang lautan tampak gajah di pelupuk mata tdk tampak bukankah di Kabinet Merah Putih patut diduga masih bercokol beberapa menteri pelaku korupsi  Konon ada yg 11 kasus ada yg 2 kasus kenapa masih aman  Kepala Desa berapa sih nilai korupsinya ,negatif,47
 PDIP tidak usah bela2 Prabowo tidak juga akan diajak di kabinet ,negatif,13
Belum juga 100 hari kabinet kerja merah putih nya  cs gak presiden nya gak menteri2 nya memakai jabatan untuk ngebuzzer remuukk tenan   ,negatif,26
 Sejak mlihat kabinet merah putih diisi orang2 yg bmasalah dan tdk kompeten plus ada BUMN yg bisa jd mesin uang krn dirutnya adlh kader partai jd makin pesimis dgn pemerintahan ini untuk basmi korupsi kolusi dan nepotisme,negatif,38
   Yg penting secara image lini kabinet semua punya gelar,positif,12
             Ngeri stigmanya dulu radikal terus anti pancasila sekarang pendukung koruptor Kabinet sekarang yang pernah dipanggil KPK itu bagaimana ,negatif,32
 Orang yg gampang dikhianati atau dibohongi anak buah jgn dikasi lagi jabatan krn itu indikasi beliau tdk becus jadi pimpinan Semoga Budi Arie segera diresafel dari kabinet MP,netral,29
Pak Presiden  yang kami hormati Tolong buktikan janji Anda bahwa kabinet Anda bersih dari koruptor dan pelaku perbuatan jahat lainnya Rakyat monitor kata politisi Demokrat siapa tuh namanya ,negatif,29
Dari bidang keuangan hingga pemberdayaan perempuan mereka hadir untuk membawa perubahan Berikut adalah daftar lengkap beserta peran 14 Srikandi Kabinet Merah Putih yang perlu  tahu Sumber id     ,positif,33
 Fenomena dan bukti kekuatan Cawe Cawe masih berkuasa Presiden Prabowo adalah satu satunya presiden yg tak memiliki hak prerogatif Kabinet Cawe Cawe adalah 60 adalah susupan dari cita cita tiga periode Hukum masih dikuasai oleh kekuasaan bengis,negatif,38
 tong kosong nyaring bunyinya circle kabinet ente banyak koruptornya  emang berani nangkep  apa takut sama mereka karena mereka orangnya Pak Mulwkwkwk,negatif,24
Wkwkwkwkwkwk dilepeh tuh Nadiem sama Fufufafa Udah bener aku curiga sejak awal Kabinet Indonesia Maju malah banyak yang mulai gak jelas gini,negatif,22
  Sebutan mas Menteri pada menteri kabinet ini dalam rapat di dpr juga banyak disebut yaa,netral,17
